,Page url,nama-responden,date-review,title,date-stay,text,rev
236,https://www.tripadvisor.com/Hotel_Review-g608492-d7907965-Reviews-or2030-Padma_Resort_Ubud-Payangan_Gianyar_Regency_Bali.html,,,,,Padma was such a great place to stay with friends and family. It is a little further away from Ubud central but not so far that it's a problem. My husband and I had a friend join us and we thought at first we may need a 2nd room. All 3 of us fit very comfortably even with the rollout bed. We ate several times there and the food was good but going out in the evening for dinner can seem a little far to the center. The grounds are kept in great condition and the pool is incredible (largest infinity pool I've seen) we will definitely be back.,Positive
237,https://www.tripadvisor.com/Hotel_Review-g608492-d7907965-Reviews-or2050-Padma_Resort_Ubud-Payangan_Gianyar_Regency_Bali.html,mebecher,mebecher wrote a review Mar 2017,A Fantastic Find,Date of stay: March 2017,Pool bar is soo good but expensive you can visit here but drinks are expensive but you can enjoy the view of the jungle the workers Are so kindly and speek english very well imean better than other hotel workers,Negative
238,https://www.tripadvisor.com/Hotel_Review-g608492-d7907965-Reviews-or15-Padma_Resort_Ubud-Payangan_Gianyar_Regency_Bali.html,citra m,citra m wrote a review Jan 10,Hidden paradise in ubud,Date of stay: January 2021,"Quite n lovely place to stay with family,,good infinity pool,,good food n excellent services from the staff,,,the room is very clean,,still has an iron n d table meanwhile some fivestar hotel dont provide it,,,i love stay in padma ubud,,,it was such a lovely place to stay in bali",Positive
239,https://www.tripadvisor.com/Hotel_Review-g608492-d7907965-Reviews-or2045-Padma_Resort_Ubud-Payangan_Gianyar_Regency_Bali.html,Mackster Z,Mackster Z wrote a review Apr 2017,Paradise,Date of stay: March 2017,Rather new hotel with true 5 stars service. Spa is great. Infiniti pool is amazing. Food is excellent. Service the best. Breakfast is huge. Too many choices :-) Only downside maybe is that it takes around 40 mins to get to Ubud. With the free shuttle that has Wifi. We would definitely go again. Had a wonderful stay,Positive
240,https://www.tripadvisor.com/Hotel_Review-g608492-d7907965-Reviews-or50-Padma_Resort_Ubud-Payangan_Gianyar_Regency_Bali.html,Rezza,Rezza wrote a review Dec 2020,"Amazing Hotel, Many Activities and Great Staff",Date of stay: December 2020,"Really enjoyed our 3 night stay in this hotel, The hotel is perfect, with load of activity. For kids they have outdoor activity and my son is really happy to join, Breakfast menu are great, also enjoyed dinner food at Puhu Restaurant The location are quite far, but they provide shuttle service to ubud center which is very helpful. Definitely will come back again if visiting Bali.",Positive
241,https://www.tripadvisor.com/Hotel_Review-g608492-d7907965-Reviews-or2045-Padma_Resort_Ubud-Payangan_Gianyar_Regency_Bali.html,pmbolger,pmbolger wrote a review Apr 2017,"Amazing hotel, spectacular scenery!",Date of stay: April 2017,"Recently stayed with my partner and 3mnth old. What an amazing resort! The staff were so helpful and we felt like we were the only ones there. The hotel is a decent 45min drive to Ubud centre so keep in mind but shuttles run on set times. Some awesome paved running/walking tracks around the hotel and there is always something to do. However lazing by the unbelievable infinity pool for hours on end is hard to beat. The rooms are appointed with quality fittings and having your own espresso machine had me hook, line and sinker. Anything longer than a week would be a little too much if your into getting out and about. Definitely go back.",Positive
242,https://www.tripadvisor.com/Hotel_Review-g608492-d7907965-Reviews-or65-Padma_Resort_Ubud-Payangan_Gianyar_Regency_Bali.html,kevin s,kevin s wrote a review Nov 2020,Nice hotel nice activity,Date of stay: November 2020,"Recommended place to stay with family because padma get so many activity that make you dont need to go outside Thanks to activity instructor Sundana, Made to make my visit unforgetable. One of best resort in Bali",Positive
243,https://www.tripadvisor.com/Hotel_Review-g608492-d7907965-Reviews-or2165-Padma_Resort_Ubud-Payangan_Gianyar_Regency_Bali.html,,,,,"Relocated to the Padma Resort from another hotel in Ubud for 2 nights, which turned out to be a blessing as what a wonderful resort with the most breathtaking views. Pool area, room and gym beautiful and views from every angle of the property. Wide selection of food which was all good and nice breakfast buffet. Shuttle bus to Ubud for those wanting to explore. Club suite and lounge also worth the upgrade. A big thanks to the management (Reza and Hendy) and staff for the perfect service from our initial late in the evening arrival to our departure.",Positive
244,https://www.tripadvisor.com/Hotel_Review-g608492-d7907965-Reviews-or25-Padma_Resort_Ubud-Payangan_Gianyar_Regency_Bali.html,Theforcejedisith,Theforcejedisith wrote a review Dec 2020,Jungle Trekking on Padma Ubud,Date of stay: December 2020,"Reservation Team was very flexible and fast response to change our reservation date. Check in was hendled by Debby, it was very quick and informative. All areas applied high standard of health protocol for covid-19. There is hand sanitizer everywhere, thermogun, and they provide disposable mask as well. The room was clean and tidy, there is a sign on door knob ""this room has been cleaned and sanitized"" The sweetest moment when we enter the room and we surprised by decorated bed with swan towel, flower petal, and also they give us a complimentary honeymoon cake in the fridge. We have a free afternoon tea with stunning view at The Puhu Restaurant. The pool was amazing. 89-meters infinity pool make it the longest swimming pool in Ubud. It is HEATED ! Warm water, jaw breaking",Positive
245,https://www.tripadvisor.com/Hotel_Review-g608492-d7907965-Reviews-or2215-Padma_Resort_Ubud-Payangan_Gianyar_Regency_Bali.html,Paige F,Paige F wrote a review Nov 2016,Must stay romantic retreat!,Date of stay: November 2016,"Room smelt of mould, being stuck in the middle of a jungle is not my idea of fun. There concept is you are here now we can CHARGE you 5 star prices for 3 star service. Example, had a massage included in package electronically but still needed a paper voucher,coulded be bothered in the end. Very expensive to get to Abud by taxi, the only saving grace was the food was of a 3.5 out of 5 standard. Cheers DM",Negative
246,https://www.tripadvisor.com/Hotel_Review-g608492-d7907965-Reviews-or2225-Padma_Resort_Ubud-Payangan_Gianyar_Regency_Bali.html,,,,,"Room: Excellent. Spacious, with balcony and pool view. Club lounge: Literally spent 10 hours a day here. Kind of crazy amazing views of the pool and forest, great service, amazing smoothies, good internet, plug for your laptop for work, just overall really relaxing. Location: Far from center (25 minutes). Good to get away though, once you're there you don't really want to leave anyways. And they have free shuttles to town throughout the day and evening. Dining: Excellent. Like, really good food, Flavours on point. Great variety. Best juices and smoothies i've had in months (and I had quite a few). Amenities: Gym is small, but sufficient. Has showers etc. Only gripe of my whole stay was that they played weird beach music in the gym. Asked to change it a few times but not",Positive
247,https://www.tripadvisor.com/Hotel_Review-g608492-d7907965-Reviews-or2215-Padma_Resort_Ubud-Payangan_Gianyar_Regency_Bali.html,Diana V,Diana V wrote a review Nov 2016,Honeymoon,Date of stay: November 2016,"Service is Bali is good, but these guys take it to a whole new level. I have TO commend the level of hospitality and service of every staff member we met, they were incredibly polite, efficient, meticulous and thoughtful. Some examples - Yogi from the top floor restaurant escorting us personally all the way to the poolside cafe just to show us the correct way. The waiter Slam who noticed we didn't finish our salad and bringing out two different dressings without being asked for. Service aside, the view is RIDICULOUS. The infinity pool is amazing, with the backdrop of the jungle, fog, and birds gliding playfully across the water. The gardens were incredibly lush, well kept and vibrant. The only thing to note is that this resort is literally in the jungle - it is not near Ubud",Positive
248,https://www.tripadvisor.com/Hotel_Review-g608492-d7907965-Reviews-or2135-Padma_Resort_Ubud-Payangan_Gianyar_Regency_Bali.html,Marius C,Marius C wrote a review Jan 2017,"Idyllic up-country resort for scenic beauty, peace and quiet",Date of stay: January 2017,"Set in a lush valley, with beautiful forest surroundings, this resort is a jewel. The heated pool overlooks a deep ravine, filled with bamboo and palms, where it is also possible to wander. A heated pool in Bali? Even on the sunniest days, the warm water is welcome, as the resort is quite high up, and evenings/early mornings can be cool. Buffet or a la carte meals in the main restaurant were varied and excellent. Music and Balinese dancing are provided almost every night. Although the food is generally westernized, brilliant chef CK will arrange authentic Balinese dishes, and even a full-scale rijstaffel at a reasonable price. Staff in general are wonderful here -- not just the legendary Balinese smiles, but genuine helpfulness and kindness. Resort experience manager Deasy",Positive
249,https://www.tripadvisor.com/Hotel_Review-g608492-d7907965-Reviews-or2120-Padma_Resort_Ubud-Payangan_Gianyar_Regency_Bali.html,Khouw,Khouw wrote a review Jan 2017,A Room With A View,Date of stay: January 2017,"Since I was solo traveling, i always tried looking for small boutique hotels. So for me, this was an unsure call.. i'm happy to say now, that it was for sure a right call! The room was spacious with a balcony and the best green views. The staff were SUPER friendly and helpful! The spa is something else outta this world. And finally the pool? I could stay there forever. Haha! They also offer free shuttle transfer to town, as well as activities such as yoga, cycling and others! Make sure you ask the reception to know more!",Positive
250,https://www.tripadvisor.com/Hotel_Review-g608492-d7907965-Reviews-or2050-Padma_Resort_Ubud-Payangan_Gianyar_Regency_Bali.html,AndrewStuart2017,AndrewStuart2017 wrote a review Mar 2017,Our Honeymoon Resort in Tropical Paradise,Date of stay: March 2017,"Sitting in the rain forest with Magnificent views and gardens surrounding this hotel their gardens are great for an early morning or evening walk. They also have a vegetable and fruit garden for hotel use, I was very impressed with this. The hotel give guided tours through them, worth doing. Also a walking/ jogging track. Though we are unable to do this our selves Ive been told by other guests it is one of the best as it goes through the rain forest. We stayed in the club room suites, and the room was extremely well thought out. One thing that impressed us was all the switches for lights etc had names on",Positive
251,https://www.tripadvisor.com/Hotel_Review-g608492-d7907965-Reviews-or60-Padma_Resort_Ubud-Payangan_Gianyar_Regency_Bali.html,,,,,"So I stay here for two nights. From the beginning, the hospitality are great. Especially the activity division. They’re very kind and always care with their guest. Lastly, shotout for one of the butler named agus mikadana for teaching me how to fishing there. :)",Positive
252,https://www.tripadvisor.com/Hotel_Review-g608492-d7907965-Reviews-or2290-Padma_Resort_Ubud-Payangan_Gianyar_Regency_Bali.html,Julie P,Julie P wrote a review Sep 2016,Wow!,Date of stay: August 2016,"So impressed with this new resort outside of Ubud. First impressions are 'wow', what a magnificent foyer and reception area with beautiful landscaping and even a couple of trendy vertical green walls. It's inifinity pool is just amazing if a tad too warm and service very good particularly the guys at the swim up bar. This place is for rest and relaxation. We had a lovely massage which came as part of the package deal. It's quiet and peaceful as it's half an hour out of Ubud in a bamboo forest. That distance from Ubud means you have to be content with hotel food, and it was good, but if you are staying for more than three days you may want to taxi into a Ubud restaurant. We did catch the hotel shuttle during the day to shop in Ubud and were glad to escape the chaos and noise",Positive
253,https://www.tripadvisor.com/Hotel_Review-g608492-d7907965-Reviews-or2325-Padma_Resort_Ubud-Payangan_Gianyar_Regency_Bali.html,Cynthia K,Cynthia K wrote a review Jul 2016,"i'm impress , for real!",Date of stay: July 2016,"So today is my birthday and my boyfriend surprise me with lunch at parma and the view was so awesome! and i've meet the one who helped my bf her name is anita cicilia she's so nice and helpful! love her! for the food , appetiser not so good but for the main course so good! love it! the room so cozy and nice LOVE IT!",Positive
254,https://www.tripadvisor.com/Hotel_Review-g608492-d7907965-Reviews-or30-Padma_Resort_Ubud-Payangan_Gianyar_Regency_Bali.html,Steven K,Steven K wrote a review Dec 2020,Outdoor Archery Activity was FUN,Date of stay: December 2020,"So we stayed 2 nights in Padma and did the Archery Activity on the last day. Pak Made was very nice and patient with my group, so the whole family ended up having a blast in this free of charge activity. Thank tou for the good experience.",Positive
255,https://www.tripadvisor.com/Hotel_Review-g608492-d7907965-Reviews-or2360-Padma_Resort_Ubud-Payangan_Gianyar_Regency_Bali.html,KathrynAudsley,KathrynAudsley wrote a review Jun 2016,June 2016,Date of stay: June 2016,"special thanks to all the team, for the pool staffs and everyone! trying their best and greatest infinity pool and trying the food in the pool restaurant, everything is excellent! special thanks to mr.putu, who recommend this place. service was amazing! thanks to mr.koka, rizkia, I kadek slamet, ilham and catur. wow! I remember their name, it's because they're doing their job very good! so memorable! and also, the food, its good, I mean, for nasi goreng is a good portions with the condiments. and also, crab salad, so fresh! I'm here with my friends, which is, they are on holiday, and they want to spending their last day in beautiful place, and voile, they are really happy! again, I will recommend this place to another my friends, relatives too. HIGHLY RECOMMEND THIS PLACE!",Positive
256,https://www.tripadvisor.com/Hotel_Review-g608492-d7907965-Reviews-or2170-Padma_Resort_Ubud-Payangan_Gianyar_Regency_Bali.html,,,,,Staff very committed. Hotel top quality. It's a bit isolated but there's free trips to town and back. The pool is excellent - v warm and great bar. The food is excellent too. The organic garden is worth a visit. Our room was phenomenal. The bathroom was designer. The hotel is only a couple of years old and all the fixtures and fittings are brand spanking new. Go there. You won't regret.,Positive
257,https://www.tripadvisor.com/Hotel_Review-g608492-d7907965-Reviews-or2360-Padma_Resort_Ubud-Payangan_Gianyar_Regency_Bali.html,Michael T,Michael T wrote a review Jun 2016,What an amazing way to start our holiday,Date of stay: July 2016,"Started the holiday off with a bang! The hotel transfer was great, very friendly and happy to talk while on the decent drive to Padma Ubud. Once there greated with smiles and amazing service. We were in our room and shown around with 10min. Pool is amazing!! And warm even when slightly cold outside for Bali. Swim up bar was great and the service around the pool was outstanding. I would highly recommended Padma Ubud for people who want to get away from the typical busy Bali to unwind and relax. Amazing!",Positive
258,https://www.tripadvisor.com/Hotel_Review-g608492-d7907965-Reviews-or55-Padma_Resort_Ubud-Payangan_Gianyar_Regency_Bali.html,Erlin tirto,Erlin tirto wrote a review Nov 2020,Hidden gem in Ubud,Date of stay: November 2020,"Stay for 2 nights in Padma Ubud, likely the other Padma hotels I ever stayed,I love the most is Padma Ubud, the weather,the room,their pillow menu,we tried free Yoga and cycling program its very nice. The room was very clean.the breakfast had many various menu and fresh juice. The most favourite things is their pool and tried practising Yoga in their bamboo nest.All the staff was very friendly and helpfull.",Positive
259,https://www.tripadvisor.com/Hotel_Review-g608492-d7907965-Reviews-or2160-Padma_Resort_Ubud-Payangan_Gianyar_Regency_Bali.html,Hendro_Heng,Hendro_Heng wrote a review Jan 2017,Nice Hotel for escape,Date of stay: January 2017,"Stay there for New Year's eve with friends. Plus: The rate really worthed for New Year's eve. The room was so clean. Give refill for mineral water. The room was really clean. The waiter still tried to accomodate the need even when the resto was so full. Love the guy who escort us to the room and explain the room functions. The Housekeeping who can explain what to do and to see in the resort..... 2 thumbs up.... Love the way the staff, even the managerial level to greet the guests upon arrival and leaving the resort.... Never see things like this..... Small attention but really bring big impact. Minus: The Sofa in balkon not really clean. At first thought that the new year's eve will be average or boring. But the staffs who really made the events Happening. The hotel design",Positive
260,https://www.tripadvisor.com/Hotel_Review-g608492-d7907965-Reviews-or2075-Padma_Resort_Ubud-Payangan_Gianyar_Regency_Bali.html,huynh2701,huynh2701 wrote a review Feb 2017,Paradise in Heaven,Date of stay: February 2017,"Stayed for four nights at Padma Resort 14-18th February 2017. This was our first time in Bali and Padma was our first 4 nights with a further 6 in Seminyak. We booked the hotel through the Flight Centre as part of a 3 stop package so i'm not entirely sure of the price we paid for this resort (it was worth it whatever we paid anyway) Our transfer took around 90mins from the airport. (it takes 2 hours to transfer to Seminyak). We did not use the hotel transfer service from the airport as we used Buffalo tours as our transfer provider (found to be a very good in Kuala Lumpur, Singapore and now Bali). We arrived late into the resort and although it was very quiet we were welcomed by staff and provided with a refreshing drink. Check in process was simple and quick. We were",Positive
261,https://www.tripadvisor.com/Hotel_Review-g608492-d7907965-Reviews-or2190-Padma_Resort_Ubud-Payangan_Gianyar_Regency_Bali.html,Andreajaja,Andreajaja wrote a review Dec 2016,What a view...,Date of stay: March 2016,"Stayed here (1x person) in march 2016 and used there special openingsoffer. Stayed 3x nights in a Premier Room incl bfst, high tea, dinner and massage. As they only had this offer for two persons in a room... They gave me 2x dinners and 2x massages. I would give 5* for the location and the crazy beautiful infinity pool! If you want to relax by the pool or enjoy the fantastic scenery, this is the place to go. It is far away from everything and it will take a long drive to Ubud. If you need some action or want to go shopping, I suggest you request a free ride to their sister hotel in Legian and make you're own way back to the hotel. Lots of guests divide their stay between the two hotels so a few times a week they will drive to Legian. Do participate in the free cyclingtour",Positive
262,https://www.tripadvisor.com/Hotel_Review-g608492-d7907965-Reviews-or2310-Padma_Resort_Ubud-Payangan_Gianyar_Regency_Bali.html,keava h,keava h wrote a review Aug 2016,"10/10 amazing visit, everything about it is perfect. Great get away abit far from Ubud maybe 30 minute drive",Date of stay: July 2016,"Stayed here for 3 days, wished it was longer, loved the seclusion. Free Shuttle into busy Ubud and return 3 or 4 times a day. Rooms big and well appointed. Great bathrooms. Good wifi throughout. Good food and service. Will return. Clean restaurant and service around the pool was very good.",Positive
263,https://www.tripadvisor.com/Hotel_Review-g608492-d7907965-Reviews-or2090-Padma_Resort_Ubud-Payangan_Gianyar_Regency_Bali.html,,,,,Stayed here with my girlfriend over her birthday and what a place to stay. The quality of the rooms are second to none and I don't even need to say how amazing the pool is. I think a lot has to do with the staff at hotels on the overall experience and Padma Ubud has without question the best hotel staff I've experience. Super friendly and went above and beyond when I was feeling sick.,Positive
264,https://www.tripadvisor.com/Hotel_Review-g608492-d7907965-Reviews-or2415-Padma_Resort_Ubud-Payangan_Gianyar_Regency_Bali.html,Faby-Secret,Faby-Secret wrote a review Apr 2016,Don't want to leave!!!!,Date of stay: April 2016,"Staying 4 days in kuta with fun and hassle make me think to decide for a relaxing time in ubud... Too many hotel in ubud but my eyes locked in to padma ubud. A bit nervous because the hotel is new and far from city but hey, it is just a perfect place for me. To make my adventure complete, I decided to drive by myself there, it was long but fun drive. When I reach the hotel entrance, greeted by the security and continuo another 5 mins drive to reach lobby, reaching reception and she knows my name.. Yes, it calls 5 stars service. Room is amazing, with balcony and OMG the bathroom, I just can't believe the space and design. Jump into infinity pool while sipping padma belissima is just a good starting. Breakfast is wonderful.. Too many food.. I gave a try for a village tour, it was",Positive
265,https://www.tripadvisor.com/Hotel_Review-g608492-d7907965-Reviews-or2205-Padma_Resort_Ubud-Payangan_Gianyar_Regency_Bali.html,Steanley S,Steanley S wrote a review Nov 2016,Amazing Resort.,Date of stay: November 2016,Staying at this resort during my holiday in July and November. This place is amazing with the infinity pool facing the jugle the view was so peaceful. Clement as a new duty manager was so friendly and professional. Fiska as a staff is also so helpful and polite. I will definitely come back again in the future. Thanks Padma!,Positive
266,https://www.tripadvisor.com/Hotel_Review-g608492-d7907965-Reviews-or2125-Padma_Resort_Ubud-Payangan_Gianyar_Regency_Bali.html,rbaxter3,rbaxter3 wrote a review Jan 2017,Perfectly placed retreat,Date of stay: January 2017,"Stunning resort with amazing grounds, rooms, facilities and staff. The infinity pool is not only beautiful to look at but is the perfect temperature for swimming. The spa is top notch international quality. The food and beverages are all delicious. The staff cannot do enough for you. We cannot recommend Padma Resort Ubud highly enough!",Positive
267,https://www.tripadvisor.com/Hotel_Review-g608492-d7907965-Reviews-or65-Padma_Resort_Ubud-Payangan_Gianyar_Regency_Bali.html,Adi Ze bali,Adi Ze bali wrote a review Nov 2020,Day visit lunch and swim with family,Date of stay: November 2020,"Sudah ke 3x nya visit tempat ini dan tetap ingin kembali lagi to chill and having fun with fam, 20 nov is my bday, so i spend all day with fam by the pool ... good atmosphere, tasty food, best service we ever had.. specially thank u for mr Trio and Slamet for great and superb hospitality selama kami disana 🙏🏼, kids was happy and enjoy at kid pool area.... recomend and for sure we will be back again in very soon... cheers ✨✨✨",Positive
268,#PAGE_URL,name,date-review,title,stay-date,text,Negative
269,https://www.tripadvisor.com/Hotel_Review-g608492-d7907965-Reviews-or60-Padma_Resort_Ubud-Payangan_Gianyar_Regency_Bali.html,Budi Michael Oloan Hasibuan,Budi Michael Oloan Hasibuan wrote a review Nov 2020,Very enjoyable family and me time for each of us,Date of stay: November 2020,"Thank you for the Hotel staffs who always accompanied my and my son and wife during each of us and family activities, enjoyable and remakable stay @ Padma Hotel in Ubud for my family due to its good facilities and warm treatment from its managment and staffs. It's our 3rd to visit and stayed to this Padma Hotel in Ubud besides visited and stayed in Padma Hotel in Bandung. In Padma Ubud, each of my family member has its own activities, which follows: FOr my son,he went to animal garden to do fishing, to feed animal (otter and birds and chicken) and had agro activities (planting and coloring). My wife has manicure and padicure and scrubbed for her self i the Ubud Hotel Spa. For my self, without my knowing,it turns out that now they already have a driving range so that I",Positive
270,https://www.tripadvisor.com/Hotel_Review-g608492-d7907965-Reviews-or2210-Padma_Resort_Ubud-Payangan_Gianyar_Regency_Bali.html,Navigator482047,Navigator482047 wrote a review Nov 2016,Mrs Grace,Date of stay: November 2016,Thank you Padma for sharing this magical jungle retreat with us tourist. Be prepared to be gobbsmacked the landscapeing adds to the natural beauty. The young vibrant staff are so helpful and friendly. The view from our balcony was so serene felt like we where soaring above the trees The way you designed the pool ponds artwork are amazing can't wait to return. Pool bar coctails and food in pool restaurant were delicious.,Positive
