,Page url,nama-responden,date-review,title,date-stay,text,rev
341,https://www.tripadvisor.com/Hotel_Review-g608492-d7907965-Reviews-or2440-Padma_Resort_Ubud-Payangan_Gianyar_Regency_Bali.html,Dita A,Dita A wrote a review Feb 2016,Amazing honeymoon and husband's birthady at Padma Ubud,Date of stay: February 2016,"This is the first time my husband and I have stayed at Padma Ubud and we had the best experience ever during our stay at Padma Ubud, it is like small paradise in Ubud, the hotel room was spacious, the room view was amazing, fine dining and room service was excellent, infinity pool was beautiful. At this time I would like to say thank you to all staff there, especially to Deasy, Akbar, Ari, and Koka, they were so great and totally help me to arrange my husband's birthday surprise at Puhu Restaurant last Sunday. They always give the best service to us and know exactly how to pamper us. My husband and I was so happy. We really didn't want to leave and we hope to come back again, we couldn't have found a better place. W definitely in love with Padma Ubud!!!",Positive
342,https://www.tripadvisor.com/Hotel_Review-g608492-d7907965-Reviews-or2405-Padma_Resort_Ubud-Payangan_Gianyar_Regency_Bali.html,altheriddler,altheriddler wrote a review Apr 2016,3 day stay at Padma resort Ubud - sensational,Date of stay: April 2016,"This is the first time we have stayed near Ubud. The Padma resort is approximately 30 minutes drive from Ubud itself thus making it 2 hours from the airport. We had booked to stay for 3 nights then move on to the Padma resort in Legian. I must say the resort is stunning. Set into natural bush and surrounded by rainforest it gives the place a very tranquil feel. As this is a new resort there were not many people staying. We were given room upgrades on arrival (room 217 looks over the pool area with a lovely view of the rainforest) The service from all staff was exceptional. This was partly due to the fact that there were only a handful of guests, but also it is a Padma resort, which are known for their service and attention to detail. One of the great things about this resort is",Positive
343,https://www.tripadvisor.com/Hotel_Review-g608492-d7907965-Reviews-or2280-Padma_Resort_Ubud-Payangan_Gianyar_Regency_Bali.html,Richard A,Richard A wrote a review Sep 2016,Excellent Padma Resort,Date of stay: June 2016,"This Padma resort is relatively a new hotel and located in Ubud, Bali. We were staying at the middle tower facing the infinity pool, with a breathtaking view. The rooms are big, efficiently layout and comes with very good furnishing and quality workmanship. Beds are very comfortable, their spas are also very good. Restaurant offer good selection and taste of food during breakfast. Their infinity pool is very2 nice, and the water is also heated which makes it very comfortable in a chilled weather of Ubud. The only downside so far is their gym as it is very small and not equipped with proper gym equipment for hotel this size and quality. Their location is also pretty remote but hotel offers free & convenient shuttle service to Ubud central. We'll definitely come back.",Positive
344,https://www.tripadvisor.com/Hotel_Review-g608492-d7907965-Reviews-or2230-Padma_Resort_Ubud-Payangan_Gianyar_Regency_Bali.html,,,,,This place can be defined only in one word -Stunning!! Even better than Padma Legian (which is good too). We stayed at Padma resort Ubud for 5 nights. It's approx 35mins away from Ubud's craziness. We love peace and quiet. The valley view is just breathtaking. Kids club is entertaining. More toys and books will be a welcome addition. Kids club staff are gentle and beautiful. My daughter had a great time doing daily activities. She kept wanting to go back even after we had checked out. We got a room with a valley view and the infinity pool view. We took club premier room which came with club access. Breakfast was included. Fantastic spread. Mixed varieties for all kinds of tastes. Hot fresh food section was amazing. Staff were friendly and very helpful. Always with a,Positive
345,https://www.tripadvisor.com/Hotel_Review-g608492-d7907965-Reviews-or2250-Padma_Resort_Ubud-Payangan_Gianyar_Regency_Bali.html,Roger C,Roger C wrote a review Oct 2016,Excellent Bali location,Date of stay: October 2016,This place has it all. It may be a bit removed from all the hustle and bustle of Seminyak etc but the service is beyond reproach. Nothing is to hard for them. Views and amenities are perfect. Wife has a gluten intolerance and vegetarian so when we had our meals they had prepared a special menu just for us plus they remembered the next day and asked how they could help again. What more could you ask for. Will come back.,Negative
346,https://www.tripadvisor.com/Hotel_Review-g608492-d7907965-Reviews-or2350-Padma_Resort_Ubud-Payangan_Gianyar_Regency_Bali.html,,,,,"This place is AMAZING, The service is truly amazing, relaxing place to be. We stay for 3 nights and we will come back again for sure. Pak Reza is very attentive person and Ferdy welcomes us very well. The hotel is very nice and clean, the jogging track is good and Yoga everyday. Foods abudants for everyone to eat.",Positive
347,https://www.tripadvisor.com/Hotel_Review-g608492-d7907965-Reviews-or2095-Padma_Resort_Ubud-Payangan_Gianyar_Regency_Bali.html,Charlene X,Charlene X wrote a review Feb 2017,The best place in Bali,Date of stay: February 2017,"This place is incredible. The staff are to be commended for there efforts. The hotel is immaculate. Come here for a memorable and wonderful holiday. You will be impressed by the pool, the buffet breakfast, the yoga, the walks through the rain forest and of course the breathtaking view by sunset. Alone or as a couple this place would be sure to take your breathe away. Receiving a personal thank you from your butler also gives it a nice warm touch. Will sure be back when I come to Bali again. Thank you Padma for such a wonderful stay.",Positive
348,https://www.tripadvisor.com/Hotel_Review-g608492-d7907965-Reviews-or2210-Padma_Resort_Ubud-Payangan_Gianyar_Regency_Bali.html,Kat B,Kat B wrote a review Nov 2016,Amazing! Perfect!,Date of stay: November 2016,"This place was nothing short of INCREDIBLE!! First time staying in Bali and we were SO impressed! We only stayed 3 nights then headed into Nusa Dua (Nusa Dua accomodation was very disappointing by comparison) The most beautiful staff! Would ALWAYS be greeting you with a smile whenever they saw you. GREAT room!! So spacious, clean and luxurious!! We felt like QUEENS and would say everyone needs to add this one to there bucket list!! Location was BREATH TAKING!! Can't wait to go back!!!!",Positive
349,https://www.tripadvisor.com/Hotel_Review-g608492-d7907965-Reviews-or2025-Padma_Resort_Ubud-Payangan_Gianyar_Regency_Bali.html,Bigbabyjezus,Bigbabyjezus wrote a review Apr 2017,Stunning,Date of stay: April 2017,"This place was top notch... Never stayed at a nicer place. Staff was amazing, views are spectacular. Right in the middle of the jungle with sn infiniti pool overlooking everything. I can't believe how beautiful this place is. I will be back.",Positive
350,https://www.tripadvisor.com/Hotel_Review-g608492-d7907965-Reviews-or2020-Padma_Resort_Ubud-Payangan_Gianyar_Regency_Bali.html,GlobeTrotting706518,GlobeTrotting706518 wrote a review Apr 2017,Amazing stay,Date of stay: April 2017,"This place was way beyond my expectations. Everything about it was fantastic. Amazing views, great food, friendly helpful staff. It felt like I was in another world. The hotel has alot of facilities, and an infinity pool that overlooks the valley.",Positive
351,https://www.tripadvisor.com/Hotel_Review-g608492-d7907965-Reviews-or2320-Padma_Resort_Ubud-Payangan_Gianyar_Regency_Bali.html,jessiekate84,jessiekate84 wrote a review Aug 2016,Amazing resort!!!! Highly recommend!!!,Date of stay: August 2016,"This resort actually blew us away. After staying at many resorts through Bali this would be right up there at the top of my list. Best staff we have ever had and nothing was too much trouble. I think the staff were actually what made our experience so memorable and we can't wait to return next year. Rooms were spacious, clean and new with a beautiful balcony overlooking the incredible infinity pools which are heated. The 1.5km walking track though surrounding forest was a great way to start the day and the gym was well equipped. The spa was stunning and massages were beautiful!!! I seriously cannot recommend this resort highly enough and if you are after somewhere to stay which is relaxing with beautiful views of surrounding forest this is definitely the place for you!",Positive
352,https://www.tripadvisor.com/Hotel_Review-g608492-d7907965-Reviews-or2355-Padma_Resort_Ubud-Payangan_Gianyar_Regency_Bali.html,HenkyH,HenkyH wrote a review Jul 2016,Great gem with a catch,Date of stay: June 2016,"This resort is 40mins drive from Ubud Center, but I think this worth the drive. The room is huge and clean & the view are stunning. I enjoy the view from Puhu Restaurant where we had our afternoon tea & breakfast. So in love with the heated pool, perfect for relaxing and long enough for exercise. This hotel also have kids club & activity and free shuttle bus to ubud center. I will definitely come back to this resort.",Positive
353,https://www.tripadvisor.com/Hotel_Review-g608492-d7907965-Reviews-or2250-Padma_Resort_Ubud-Payangan_Gianyar_Regency_Bali.html,Pritha Razad,Pritha Razad wrote a review Oct 2016,A tranquil !,Date of stay: October 2016,"This resort is about 20mins from Ubud city center. But for this gem, i wouldnt go anywhere rather stay in the resort as they have everything. Heated largest infinity pool in the region, swim up pool bar, pool side restaurant, all day dining restaurant with beautiful and spacious room. Beautiful !",Positive
354,https://www.tripadvisor.com/Hotel_Review-g608492-d7907965-Reviews-or2385-Padma_Resort_Ubud-Payangan_Gianyar_Regency_Bali.html,Manisha J,Manisha J wrote a review May 2016,Back to Nature,Date of stay: March 2016,"This resort is away from the city and beaches. It is a long drive though almost an hour and a half from the airport. Its set admist beautiful scenery and lush greenery. When we visited it was still very new. The rooms are nice, large and comfortable. The jogging track and jungle walk are good to get ur muscles going as the gym is quite small. The pool has warm water and is quite relaxing while one can spend the whole day enjoying the cool breeze and warm waters of the pool. All staff are very polite and friendly. The hotel also does provide a shuttle service to the Ubud City Centre which is about a 45min to an hour drive. The only thing the hotel does need to improve on is theur quality and hygine of food as its quite far, one has no option but to eat at the hotel. Hence,",Positive
355,https://www.tripadvisor.com/Hotel_Review-g608492-d7907965-Reviews-or2020-Padma_Resort_Ubud-Payangan_Gianyar_Regency_Bali.html,LizF12345,LizF12345 wrote a review Apr 2017,Sensational place if you require serenity,Date of stay: April 2017,"This resort is located a 30 minute drive from Ubud, in the remote area of Payangan. If you want to enjoy a relaxing holiday, without the hustle and bustle of areas closer to the airport, then this place is for you. The 89 metre infinity pool is meticulously maintained, and includes a swim up bar. The resort facilities include a gym, a kids club, day spa and more. A free shuttle bus service operates from the resort to Ubud every day, at different times to suit. Also offered are a range of daily activities, including yoga and cycling. We went on a bike ride through the villages, and experienced the most beautiful scenery. We have been on paid bike tours in Bali before, and this ride was even better, and all included. The staff at this resort are outstanding, and nothing is ever",Positive
356,https://www.tripadvisor.com/Hotel_Review-g608492-d7907965-Reviews-or2420-Padma_Resort_Ubud-Payangan_Gianyar_Regency_Bali.html,,,,,"This resort is magnificent. Beautifully landscaped, huge infinity pool with swim-up poolbar, nice spa, very good breakfast buffet. Rooms are big and really well designed. Every day there are free activities like village-visits, bicycling tours, Balinese dancing etc. Staff is super friendly and attentive. I would recommend this place to anyone.",Positive
357,https://www.tripadvisor.com/Hotel_Review-g608492-d7907965-Reviews-or2140-Padma_Resort_Ubud-Payangan_Gianyar_Regency_Bali.html,,,,,"This resort is really special! Set in the middle of the jungle, you are completely away from all the hustle and the bustle which my husband and I loved. Waking up to all the majestic views overlooking the jungle was breathtaking and felt so relaxing. Being so deep in the jungle meant the air is super clean... both of us were at the tail end of a cold and I'm convinced the air completely flushed us out! So good! There are no words to truly describe the swimming pool at this resort... just know you will be blown away and will easily spend most of your time by the poo, enjoying the everything the space has to offer... pool bar, pool heating, magical views, and more swimming room than I have experienced (outside the ocean of course). The food at this place also 10/10. Very fresh and",Positive
358,https://www.tripadvisor.com/Hotel_Review-g608492-d7907965-Reviews-or2230-Padma_Resort_Ubud-Payangan_Gianyar_Regency_Bali.html,Scott P,Scott P wrote a review Oct 2016,Amazing and Friendly,Date of stay: October 2016,"This Resort is the best resort that myself and girlfriend have ever stayed at and our 3 night stay felt way too short. The first impression upon arrival of the resort is 'paradise in the mountains'. We stayed on the 4th floor which had a spectacular view of jungle and gardens. The rooms are outstanding, clean (practically new), spacious and well set out. (We loved the towel swan that was on the bed on arrival). The resorts food was impeccable we ate every meal of our stay at the resort. The food quality is of a high end restaurant but what we enjoyed the most was the atmosphere and the friendly and attentive staff. We spent a large amount of our time in the infinity pool where we were well looked after by every staff at the ""sunken bar"". After sampling various of the",Positive
359,https://www.tripadvisor.com/Hotel_Review-g608492-d7907965-Reviews-or2035-Padma_Resort_Ubud-Payangan_Gianyar_Regency_Bali.html,natislandq,natislandq wrote a review Apr 2017,"Beautiful location, stunning resort",Date of stay: April 2017,"This resort nestled in the terraced hills about 30 mins North of Ubud was for next level relax mode. The room was huge, clean and well appointed. It's the little things like plenty of room for luggage and bench space in the bathroom plus a shelf in the shower. Huge twin beds, huge fluffy bath towels huge free standing bath and huge shower. The pool is an infinity lagoon and heated so you can enjoy it longer in the 'cooler' breezes of the hills. The shuttle bus was great to get into Ubud to shop and get a cheap massage. The in house spa looked amazing but priced out of practical use. Room service was great and despite the reviews I read we loved the restaurant. Complimentary afternoon tea was pointless but the chef has talent he uses well in the degustation dinner menu. The",Positive
360,https://www.tripadvisor.com/Hotel_Review-g608492-d7907965-Reviews-or2095-Padma_Resort_Ubud-Payangan_Gianyar_Regency_Bali.html,Vicki S,Vicki S wrote a review Feb 2017,Serene picturesque,Date of stay: January 2017,This trip to Bali involved a 2night swap stay from Padma legian to Padma Ubud. The resort is set in stunning lush green grounds complete with beautiful views of rain forests and rice paddies. The resort is about 20 minutes from the town of Ubud but the resort provides shuttle buses to get you there and back. It has the biggest infinity pool in Bali. 93 metres of water with a breathtaking view to wile away the time. All rooms have a view and are spacious and decorated in traditional yet modern style. And to our delight an afternoon tea was provided for all guests and catered for allergies. There are an assortment of daily activities including bike riding and yoga. This is a great place to recharge and relax.,Positive
361,https://www.tripadvisor.com/Hotel_Review-g608492-d7907965-Reviews-or2440-Padma_Resort_Ubud-Payangan_Gianyar_Regency_Bali.html,CiptaIndri,CiptaIndri wrote a review Feb 2016,Experience Heaven in Bali,Date of stay: February 2016,"This was my first time to Bali and grateful to choose Padma Ubud as our place to stay. Even though we were only staying for one night but we had an amazing experience. Since we arrived, we were greeted by a friendly staff, offered a welcome drink, and the staff also explained all the facilities in our room with friendly manner. In the late afternoon, I ordered their classic tiramisu and found that it was so good! One of the best facilities in Padma Ubud you must try is their Infinity Pool. It has direct view of the forest. Makes me feel calm and refreshed. So amazing and mesmerized! But unfortunately we could not enjoy their spa because it was fully booked on the day of our arrival and the next day we had to move to Kuta in the morning. We also enjoyed breakfast in Puhu",Positive
362,https://www.tripadvisor.com/Hotel_Review-g608492-d7907965-Reviews-or2305-Padma_Resort_Ubud-Payangan_Gianyar_Regency_Bali.html,,,,,"This was one of the best hotels I have ever stayed in, from the beautiful fish in the gorgeous water gardens to the immaculate spacious rooms and one of the best pools I have ever swum in, overlooking the teeming jungle. I loved the frogs and crickets chirping in the gardens at night and the bats and wild life of the jungle. My ony wish is that this wonderful resort takes good care of the wild life around and inside the gardens as it so wonderful to feel part of the jungle and yet pampered like royalty.",Positive
363,https://www.tripadvisor.com/Hotel_Review-g608492-d7907965-Reviews-or2405-Padma_Resort_Ubud-Payangan_Gianyar_Regency_Bali.html,,,,,This was one of the best hotels I've stayed at. Hidden in the mountains is this beautiful place. So serene and relaxing is what I needed and this place had everything I could ask for. The staff at this resort was AMAZING!!!! They were so attentive and so sweet. I would definitely be back here again.,Positive
364,https://www.tripadvisor.com/Hotel_Review-g608492-d7907965-Reviews-or2195-Padma_Resort_Ubud-Payangan_Gianyar_Regency_Bali.html,Phil c,Phil c wrote a review Dec 2016,Wow. Wow. Wow,Date of stay: November 2016,"This was our first holiday in Bali. This review is based on stays in other hotels in different parts of the world, and at home in Australia. This package included airport transfers and from the moment you are met at the airport, you know this experience is going to be something different. The little laneway to the resort belies what is ahead. On arrival at the resort you are greeted by extremely friendly, polite and attentive staff. After a detailed check-in, you are shown to your room. If you haven't been impressed by the resort thus far, walking into your room will surely amaze you. The size and and substantial quality of the furnishings demonstrate the thought that has gone into providing a wonderfully relaxing and peaceful atmosphere for the guests. You will soon become",Positive
365,https://www.tripadvisor.com/Hotel_Review-g608492-d7907965-Reviews-or2180-Padma_Resort_Ubud-Payangan_Gianyar_Regency_Bali.html,Kym J,Kym J wrote a review Dec 2016,P.A.R.A.D.I.S.E.,Date of stay: December 2016,"This was our first trip to Bali and we decided to start with the rainforest rather than a beach holiday..... WOW. This resort is just AMAZING. While the drive from the airport takes about 2 hours, the resort picks you up and makes you feel at ease. This was also a great chance to look out the window and see the real Bali. When you finally reach the resort it is gorgeous. We had a family suite which consisted of 2 inter connecting rooms. The rooms were very spacious and the bathrooms.... to die for!! The staff were friendly and always had a welcoming smile. The main feature of this resort is the infinity pool and it didn't disappoint. With the swim up bar, one could stay in there for hours. The meals were a good size and the breakfast buffet in the main restaurant overlooking",Positive
366,https://www.tripadvisor.com/Hotel_Review-g608492-d7907965-Reviews-or2115-Padma_Resort_Ubud-Payangan_Gianyar_Regency_Bali.html,,,,,This was the most magical of experiences for us! The scenery is stunning the staff are just gorgeous and the chefs amazing! The resort is pristine and so so beautiful! Big shout out to the head chef Ketut and our breakfast chef who looked after us and cooked us some of the BEST meals we have eaten! Highly recommend the cooking class and spa! Wish we had longer than 3 nights here! Could easily do a week or more! So much to do in the hotel no need to leave. Why would you when you have everything you need right here and the scenery is second to none! The pool is just amazing no wonder it won pool of the year for all of Indonesia in 2016! We will definitely be back!! Thank you Padma Ubud for making our honeymoon so memorable! ❤❤,Positive
367,https://www.tripadvisor.com/Hotel_Review-g608492-d7907965-Reviews-or40-Padma_Resort_Ubud-Payangan_Gianyar_Regency_Bali.html,,,,,"Today, we went on a 5k biking trip to the forest. It was really cool and i'd like to give a big shoutout to our tour guide Agus. He was ver nice, very polite, and very helpful. By far the best staff member in the hotel.",Positive
368,https://www.tripadvisor.com/Hotel_Review-g608492-d7907965-Reviews-or2360-Padma_Resort_Ubud-Payangan_Gianyar_Regency_Bali.html,herwanng,herwanng wrote a review Jun 2016,Sanctuary in Ubud,Date of stay: June 2016,"Usually it's not a good sign when something goes wrong in the beginning. We waited for my pick-up from Padma at the lobby of a hotel in Nusa Dua for 15 minutes and there was no one approach me so I called Padma. Long story short, Padma has given an incorrect name to the driver. The problem was finally sort out and we left Nusa Dua half an hour behind the schedule. I was a bit upset but shortly after we arrived at Padma, I forgot about the late pick-up. The staffs are very friendly. The rooms are excellent. We managed to get our request for connecting rooms. It's very spacious although the connecting doors are somewhat designed incorrectly. It blocks the doorway when its opened. The room includes breakfast and afternoon tea with various foods selections. The infinity pool and",Negative
369,https://www.tripadvisor.com/Hotel_Review-g608492-d7907965-Reviews-or50-Padma_Resort_Ubud-Payangan_Gianyar_Regency_Bali.html,Octaviani W,Octaviani W wrote a review Dec 2020,Padma ubud,Date of stay: December 2020,"Very happy to stay here...so many activity during our staycation...i try the aerial yoga (you have to try this and they have certified yogis to help you with the move) and also cycling , the guide take me to see the village around the hotel...beautiful... for the kids, they can play around in animal graden (we love the duck...very cute), my son go fishing then fed the otter, chika & chiko...the kids garden club also interesting...the kids love it! Nice and clean room...very comfy to stay...the hotel staf also helpful...and the food so yummy (we try chicken karage, gurame asam manis also some pasta...and all made our tummy happy ) I'm sure will be back again next time. Thank you Padma Ubud.",Positive
370,https://www.tripadvisor.com/Hotel_Review-g608492-d7907965-Reviews-or50-Padma_Resort_Ubud-Payangan_Gianyar_Regency_Bali.html,Nany Ismail,Nany Ismail wrote a review Dec 2020,Biking and swimming,Date of stay: December 2020,"Very nice and lovely. The pool is sublime. Kayan, our guide for biking is so nive and kind, recommended. The view is so nice , you don't want to leave the hotel. We will come back next year with my good friends.",Positive
371,https://www.tripadvisor.com/Hotel_Review-g608492-d7907965-Reviews-or2400-Padma_Resort_Ubud-Payangan_Gianyar_Regency_Bali.html,Shonda H,Shonda H wrote a review Apr 2016,Relaxation!,Date of stay: April 2016,"Very nice service by the staf especially the manager pak Ary. The view is amazing, the swimming pool water is not cold, so my son can swim without getting cold. It is great place if u need to relax. It is 45 minutes to Ubud central. Will come back again",Positive
372,https://www.tripadvisor.com/Hotel_Review-g608492-d7907965-Reviews-or90-Padma_Resort_Ubud-Payangan_Gianyar_Regency_Bali.html,C R,C R wrote a review Nov 2020,BEST UBUD RESORT WITH FIVE STARS FACILITES AND SERVICE,Date of stay: November 2020,"very recommended resort when you stay in Ubud. Everything you need is here... Perfect Jungle view, Breakfast were AWESOME!!! Afternoon tea was beyond our expectation!!! We also joined sport activities such as Mountain bike, Golf and Archery. Mr. Kayan trained us like a PRO athlete, really enjoyed the time being here. the next day we also went to animal garden, fed some rabbits, ducks, chickens, cows, goats, andddd they have two cute otters that always HUNGRY. Defenitely one of best resort in Bali... Will come back for SURE!!!",Positive
