,Page url,nama-responden,date-review,title,date-stay,text,rev
0,https://www.tripadvisor.com/Hotel_Review-g608492-d7907965-Reviews-or2455-Padma_Resort_Ubud-Payangan_Gianyar_Regency_Bali.html,rthenu,rthenu wrote a review Dec 2015,Stunning View,Date of stay: December 2015,"45 minute driving from Ubud Central. The area far from crowds. The new hotel (soft opening). View was awesome specially morning sunrise. Very spacious room, equip with capsule coffee machine, DVD player (with no dvd disc hahaha). Bathroom also spacious. The infinity pool with warm water is the great spot for relax. Need improvement on room service food (availability and quality).",Positive
1,https://www.tripadvisor.com/Hotel_Review-g608492-d7907965-Reviews-or2325-Padma_Resort_Ubud-Payangan_Gianyar_Regency_Bali.html,Jacky Y,Jacky Y wrote a review Jul 2016,Wonderful Stay at Padma Ubud,Date of stay: July 2016,"A beautiful resort built with Balinese way. The room is clean, the pool is fantastic, every staffs are very friendly. We book a premium deluxe room and had a late check in to the resort, we been upgraded to a premium club room with a beautiful pool view! Thank you Padma Ubud, you surprised us. The pool water is warm and nice, we soaked ourselves in the pool everyday. The food in the restaurant are good, Chef Ketut is friendly and he really care for every guest satisfaction by visiting every table to talk to the guest. Spa staffs are very friendly equiped with professional skill, we booked total 3 spa session and we really enjoy it so much. The resort activities are good but we missed all that activities because we had our planned program with a local tour agent, that's why",Positive
2,https://www.tripadvisor.com/Hotel_Review-g608492-d7907965-Reviews-or2465-Padma_Resort_Ubud-Payangan_Gianyar_Regency_Bali.html,Kerry C,Kerry C wrote a review Oct 2015,Pre 'soft opening' at Padma Resort Puhu Ubud,Date of stay: October 2015,"A few days ago, I got a chance to stay at Padma Resort Ubud with my friends. As someone who had stayed at their sister hotel, Padma Legian, I have high expectations. This is because I had experience first hand the quality of hotels, staff, service there. And after two nights of staying in Padma Ubud, I must say they did not disappoint. We did not expect that the resort will be further - down in Payangan - area. We can see that there's some construction going on because it was not 100% finished yet. And even though the pathway that leads to the hotel was beautiful - we could only imagine how amazing it will be once the trees are big and lush throughout the entire hotel. Yes, we can see some construction. But the friendliness of the staff makes up for it. They were very polite.",Positive
3,https://www.tripadvisor.com/Hotel_Review-g608492-d7907965-Reviews-or2240-Padma_Resort_Ubud-Payangan_Gianyar_Regency_Bali.html,Christine O,Christine O wrote a review Oct 2016,Best hotel experience,Date of stay: October 2016,"A gem in Ubud. Like everything you could think of (except the temperature of the pool) is perfect! The hotel is new, we were told they opened in February 2016. It's beautifully made. From the reception to the gym. My son was happily feeding the fish with one of the staff :) Everyone was so helpful and friendly to our two kids. Helped with the luggage or anything else you could struggle with. The room we had (I believe every room looks the same, has a perfect layout, spacious bathroom, kingsize bed, modern and earthy furniture and a balcony with a great view. The only restaurant for breakfast and dining has great views too. A huge selection of asian and western dishes. Every single dish we had was delicious! One thing the could improve though is to leave the guests eat and be",Positive
4,https://www.tripadvisor.com/Hotel_Review-g608492-d7907965-Reviews-or15-Padma_Resort_Ubud-Payangan_Gianyar_Regency_Bali.html,Silvia H,Silvia H wrote a review Jan 10,A very nice hospitality,Date of stay: January 2021,"A lot of activities here from yoga, archery, golf, cycling, a tons of kids activity that will you had a maximum leisure time. Aerial yoga & morning cycling conducted by Mr. Made was amazing experience, worth for woke up early. The heated pool is stunning.",Positive
5,https://www.tripadvisor.com/Hotel_Review-g608492-d7907965-Reviews-or2315-Padma_Resort_Ubud-Payangan_Gianyar_Regency_Bali.html,Anitat23,Anitat23 wrote a review Aug 2016,10/10 luxury,Date of stay: March 2016,A must for lovers of the movie Avatar as the resort unknowingly reflects this movie. Needless to say staff food pool room views all absolutely amazing. Did not want to leave after 3 glorious nights. If you want to get away in total relaxation in a beautiful jungle setting this is the place. We made one trip into Ubud (40 mins) but could not wait to return to the resort for a great dinner near the pool and a magnificent night swim in the absolutely incredible infinity pool. My wife had 3 treatments in the spa she says it was great to go to a Resort spa and not have to take out a bank loan. The value was fantastic. Overall we can't rate it higher enough. We now move on to Padma Legian rested to take on a couple of adventures there.,Positive
6,https://www.tripadvisor.com/Hotel_Review-g608492-d7907965-Reviews-or2140-Padma_Resort_Ubud-Payangan_Gianyar_Regency_Bali.html,Cassandra C,Cassandra C wrote a review Jan 2017,Breathtaking,Date of stay: January 2017,"A must stay! The infinity pool is amazing, so much so that it won a worldwide competition ""pool nation"" The staff go over and beyond! Nicko in the restaurant is wonderful. Highly recommended. Even just a few relaxing nights!! Plus there are activties you can do at the resort. Like bicycle tour, learn balinese conversations,make balinese offerings etc ALL INCLUDED IN YOUR STAY.",Positive
7,https://www.tripadvisor.com/Hotel_Review-g608492-d7907965-Reviews-or2375-Padma_Resort_Ubud-Payangan_Gianyar_Regency_Bali.html,Chad M,Chad M wrote a review Jun 2016,Retreat from reality,Date of stay: June 2016,"A must to do while in Bali. The resort is about 45 minutes from Ubud but you won't want to leave. The resort is beautiful. There are great walk trails down to the river and the hotel has lots of activities. Must do is the cycling, you get to see rice fields small villages and some amazing views. This hotel is new and the rooms are incredible, luxury bathrooms, beautiful balcony etc. breakfast buffet for a king. The staff are incredible, so kind and accommodating. We will be back for our 3rd visit real soon. Thank you Padma Ubud for a great visit",Positive
8,https://www.tripadvisor.com/Hotel_Review-g608492-d7907965-Reviews-or2260-Padma_Resort_Ubud-Payangan_Gianyar_Regency_Bali.html,karnalim,karnalim wrote a review Sep 2016,Fantastic Stay,Date of stay: September 2016,"A Very nice resort in Ubud, The room, Views from the room , and infinity pool are really incredible for us. love to come back here for my next holiday. Breakfast and dinner also very nice. The staffs are very friendly.",Positive
9,https://www.tripadvisor.com/Hotel_Review-g608492-d7907965-Reviews-or2415-Padma_Resort_Ubud-Payangan_Gianyar_Regency_Bali.html,Karen E,Karen E wrote a review Apr 2016,Amazing,Date of stay: April 2016,"Absolutely beautiful place to stay. Amazing attention to detail in every way. The pool is fantastic overlooking the Jungle as is the dinning area. The day spa is under ground in a cave like area.The rooms are very generous with a huge bathroom and bath over looking the view.Staff were very helpful The only draw back is it is about 40 min north of Ubud and absolutely nothing around the hotel.The hotel offer free shuttle bus into Ubud and activities throughout the day. My Husband did the Bike ride and said it was fantastic ""A must Do"" If you want to relax this is the place but only for a few days.",Positive
10,https://www.tripadvisor.com/Hotel_Review-g608492-d7907965-Reviews-or2265-Padma_Resort_Ubud-Payangan_Gianyar_Regency_Bali.html,Azzie61,Azzie61 wrote a review Sep 2016,M&B package,Date of stay: September 2016,"Absolutely loved our stay here. One of the highlights were the yoga classes held by Budi. I even managed to get my teenage boys to participate . The pool, the location, service etc were fantastic. The only issue we had were the water bottles in both resorts are very hard to open . The design could be improved",Positive
11,https://www.tripadvisor.com/Hotel_Review-g608492-d7907965-Reviews-or2335-Padma_Resort_Ubud-Payangan_Gianyar_Regency_Bali.html,Hendry G,Hendry G wrote a review Jul 2016,Detox,Date of stay: July 2016,"Absolutely stunning resort. I came here with my mum and we both agreed that it looks like the type of hotel you have your honeymoon at. Gorgeous rooms - so new and modern and fancy! Buffet breakfast and afternoon tea included. Lovely staff! Amazing pool - which is heated to suit the outside temperature. So if it's cold outside, the pool is warm but not too hot. Great swim up bar. There is a number of included activities that are accessible to you in your pay package. Including sunrise and sunset yoga, bicycle riding, scavenger hunt for the kids, there's a bamboo bridge walk, 2.5km walking track, village visit, kite activities, muscle toning activities, planting and more!! Didn't get a chance to do it all as we only stayed a few days but the sunrise yoga was great, bridge and",Positive
12,https://www.tripadvisor.com/Hotel_Review-g608492-d7907965-Reviews-or2390-Padma_Resort_Ubud-Payangan_Gianyar_Regency_Bali.html,Belina M,Belina M wrote a review May 2016,Heaven,Date of stay: May 2016,"Absolutely the Most Fabulous Resort we have ever stayed at. We were greeted with a wonderful warm welcome by Ari at the front gate, to all the staff in the resort a big thank you to you all. The rooms were beautifully presented. The Infinity Pool with swim up bar and surrounding gardens and scenery were Breathtaking! The Restaurant at night produced a wonderful atmosphere and the Food 5 star. Afternoon Tea in the afternoon was a Lovely Touch also.( many thanks to Marzella for keeping my husband entertained with the soccer competition.) All in all a Fabulous Stay.",Positive
13,https://www.tripadvisor.com/Hotel_Review-g608492-d7907965-Reviews-or2125-Padma_Resort_Ubud-Payangan_Gianyar_Regency_Bali.html,Jess L,Jess L wrote a review Jan 2017,Couldn't be happier,Date of stay: January 2017,"After booking 8 nights accom at the Padma in Legian, we wanted to spend a day in Ubud. The concierge offered us a night at this hotel as a free exchange. We weren't sure at first however so glad we did as we could not have been more impressed with this hotel. Suited for a peaceful relaxing retreat. The rooms, faculties and staff were amazing. Nothing was too difficult for the staff, they always had a smile on their face and endeavoured to get to know us during our short stay. I wouldn't consider staying anywhere else now.",Positive
14,https://www.tripadvisor.com/Hotel_Review-g608492-d7907965-Reviews-or2235-Padma_Resort_Ubud-Payangan_Gianyar_Regency_Bali.html,TerriandSteve2006,TerriandSteve2006 wrote a review Oct 2016,OUTSTANDING.,Date of stay: October 2016,"After spending 7 nights at PADMA LEGION,we stayed 2 nights here.WOW! Absolutely stunning in everyway.The staff were excellent and so helpful at all times.The Pool,grounds and rooms were faultless.Stayed here as a family of four with 2 girls aged 7 and 6.They were treated so well by the staff and as well by the kids club also. Try the daily bike ride on offer if you're up for it.The guide,Lenor,takes you to a temple,off road through rice fields and past local houses and gives a great insight into Balinese life. All in all......can't wait to return.",Positive
15,https://www.tripadvisor.com/Hotel_Review-g608492-d7907965-Reviews-or2295-Padma_Resort_Ubud-Payangan_Gianyar_Regency_Bali.html,Nejlaaaaa,Nejlaaaaa wrote a review Aug 2016,Breathtaking view & amazing infinity pool,Date of stay: July 2016,"After spending several days in Seminyak it was nice to go up into the rain forest to this quiet secluded resort. Our highlights there included the huge heated swimming pool with the swim up bar and the relaxing spa. All of the staff were warm, welcoming and helpful. The breakfast buffet was huge with Balinese, Chinese, European and American selections. The only downside was that it was so far away from Ubud town where all of the shops and restaurants were located. Everything was 40 minutes away no matter where you went. This is a comfortable resort where you can relax and get away from it all!",Positive
16,https://www.tripadvisor.com/Hotel_Review-g608492-d7907965-Reviews-or2425-Padma_Resort_Ubud-Payangan_Gianyar_Regency_Bali.html,BrinksMP,BrinksMP wrote a review Mar 2016,TRANQUILLITY AND LUXURY,Date of stay: March 2016,"After staying at Padma Legian 3yrs ago we jumped at Ubud for our 10yr Wedding Anniversary. 5 nights in the secluded resort was amazing, the facilities, pool, location, privacy and that top Padma standard made it a holiday to remember. The resort is approx. 35min from the markets, Monkey Forrest and restaurants / shops but well worth the daily shuttle service to break up resort time and soak in the local less hectic feel of Ubud. Special mention to a few staff that made our stay memorable Gus Oka at the pool bar and the crew of Eko, Slamet, Joni and Wahyu. The restaurant team with Nico greeting you every morning with a big smile and Deasy checking in regularly to ensure your experience is first class. Thanks again Padma we will be back! Highly recommended for honeymoon",Positive
17,https://www.tripadvisor.com/Hotel_Review-g608492-d7907965-Reviews-or2380-Padma_Resort_Ubud-Payangan_Gianyar_Regency_Bali.html,,,,,"All of instrument in Padma ubud resort so AMAZING the room was sweet & so comfortable , the foods delicious & the drinks so fresh , especially ""Reza power"" is my favorite !! Hehe the employees so kind and helpful , and the best from all is the View & the infinity pool that was so beautiful.. the best place i've ever visit on vacation. Thank u Padma Ubud and Mr Reza.. Jazakallah khairan katsiran.",Positive
18,https://www.tripadvisor.com/Hotel_Review-g608492-d7907965-Reviews-or85-Padma_Resort_Ubud-Payangan_Gianyar_Regency_Bali.html,Tom,Tom wrote a review Nov 2020,The 89m infinity pool is awesome!,Date of stay: November 2020,"Amazing hotel with really good facilities. I was really surprised at how many activities they have available such as sunrise yoga, jungle trekking, archery, etc. The staff were great and very helpful. We stayed during the pandemic and the hygiene protocols were very strict without being intrusive. There's hand sanitiser in every corner, also in the room, and temperature checking on arrival and at the restaurant. Everything at check in is ""contactless"". The room was spacious and cleaned well. We ate at the pool restaurant and normal restaurant and both meals were really good, decent portion sizes and delicious. The infinity pool was insane. 89m with amazing views and it felt like we had your own pool since we were the only one's there most of the time! Definitely going to stay",Positive
19,https://www.tripadvisor.com/Hotel_Review-g608492-d7907965-Reviews-or2310-Padma_Resort_Ubud-Payangan_Gianyar_Regency_Bali.html,damomck,damomck wrote a review Aug 2016,Heaven on Earth,Date of stay: July 2016,"AMAZING HOTEL! 100% recommend, everything is perfect. Great staff great rooms great view. What more could you want. It is abit out of Ubud but you don't need to leave the hotel ever. 100% recommend to everyone. Can't say anymore, just great!",Positive
20,https://www.tripadvisor.com/Hotel_Review-g608492-d7907965-Reviews-or2270-Padma_Resort_Ubud-Payangan_Gianyar_Regency_Bali.html,BoeviAri,BoeviAri wrote a review Sep 2016,Perfect to start relaxing and adapting away from stress,Date of stay: September 2016,"Amazing hotel, I have travelled all around the world, from four seasons Louis XIV Paris to Hyatt Shanghai to ... For my standards I could say that this is one of the best options for hotel you could be accommodated in Ubud for a very reasonable price. Don't book too many days (5-6) tops there distance to any event is quite far (minimum 40minutes to 1,5hr) continue your travel to the south for better weather afterwards. Tip: ask for Suadyana the taxi driver of golden bird taxi company. You Will be helped very Well, there he is An excellent guide with suggestions. Tip: start your day early!!! Even when jetlagged start your day early at the pool from 8 till 10 and then have breakfast. The weather switches at 11am to very cloudy since you are on a mountain with a lot of",Positive
21,https://www.tripadvisor.com/Hotel_Review-g608492-d7907965-Reviews-or2190-Padma_Resort_Ubud-Payangan_Gianyar_Regency_Bali.html,togsjosa,togsjosa wrote a review Dec 2016,Exceptional !!,Date of stay: November 2016,"Amazing resort! Padma Resort Ubud is my best choice to spend my wedding anniversary. I always curious about the heated infinity pool and my curiosity answered here in Padma Resort Ubud. Wifi everywhere, even in the jungle track for jogging, Great. Room was excellent. Breakfast was also satisfying. Definitely will come back again for next trip to Bali. Thank you for the hospitality during my stay in Padma Resort Ubud, I really appreciate the resort' staffs service and warm welcome.",Positive
22,https://www.tripadvisor.com/Hotel_Review-g608492-d7907965-Reviews-or2125-Padma_Resort_Ubud-Payangan_Gianyar_Regency_Bali.html,,,,,"Amazing rooms and luxurious setting. Stayed here at Christmas for 5 nights. It was so relaxing! Staff were so lovely and helpful. Thanks to sekar for looking after our daughter. Can highly recommend this hotel for a quiet, relaxing time.",Positive
23,https://www.tripadvisor.com/Hotel_Review-g608492-d7907965-Reviews-or2205-Padma_Resort_Ubud-Payangan_Gianyar_Regency_Bali.html,,,,,"Amazing scenery and beautiful resort the staff were ever so friendly and the infinity pool amazing , food was absolutely delicious and will definitely come back in the future perfect way to relax away from the hustle and bustle of Kuta etc",Positive
24,https://www.tripadvisor.com/Hotel_Review-g608492-d7907965-Reviews-or2250-Padma_Resort_Ubud-Payangan_Gianyar_Regency_Bali.html,fikri30,fikri30 wrote a review Oct 2016,Perfect,Date of stay: September 2016,"Amazing view, amazing pool. staff was highly trained and friendly. this resort has all facilities that you need. i drop my 16 months old baby to the play room and they took care good of my kid perfectly for a couple hour. surely will comeback.",Positive
25,https://www.tripadvisor.com/Hotel_Review-g608492-d7907965-Reviews-or2270-Padma_Resort_Ubud-Payangan_Gianyar_Regency_Bali.html,sdhyun,sdhyun wrote a review Sep 2016,a little bit disappointing,Date of stay: September 2016,"Amazing!!!! Only one place to stay when visiting Bali. The service,hotel, food, heated pool floor less... I would recommend this hotel/resort to anyone for the perfect get away. No crowd no dirt just peaceful and relaxing.",Positive
26,https://www.tripadvisor.com/Hotel_Review-g608492-d7907965-Reviews-or65-Padma_Resort_Ubud-Payangan_Gianyar_Regency_Bali.html,Galalima Glamping,Galalima Glamping wrote a review Nov 2020,Beautiful place,Date of stay: November 2020,"An excellent hospitality, clean and cozy place. Very recommended for family. The animal zone really good and so fun for kids. The Spa treatment was excellent and so relaxing. The pool is amazing and so beautiful",Positive
27,https://www.tripadvisor.com/Hotel_Review-g608492-d7907965-Reviews-or2035-Padma_Resort_Ubud-Payangan_Gianyar_Regency_Bali.html,Jamara1975,Jamara1975 wrote a review Apr 2017,A slice of paradise,Date of stay: April 2017,"Arrived this morning and completely amazed by this resort. The surrounding is super, the room is beautiful, and all the staff is very nice and accommodating. Food is excellent as well. Highly recommend this place for a relaxing get away.",Positive
28,https://www.tripadvisor.com/Hotel_Review-g608492-d7907965-Reviews-or2080-Padma_Resort_Ubud-Payangan_Gianyar_Regency_Bali.html,,,,,"Awesome resort, highly recommend the mixology session with Dedy. Excellent experience, you go through their garden to collect your fresh ingredients and then off to the bar. Dedy is a pro at slinging drinks and will show you the ropes. Can't beat the price either for this fun way to spend some time at the resort",Positive
29,https://www.tripadvisor.com/Hotel_Review-g608492-d7907965-Reviews-or2275-Padma_Resort_Ubud-Payangan_Gianyar_Regency_Bali.html,Wongy67,Wongy67 wrote a review Sep 2016,Padma Ubud,Date of stay: September 2016,Awesome resort. All The Staff Were so friendly and it was so peaceful this was way more than I expected. From the moment we arrived we was impressed with our choice. Plenty of resort activities to keep you amused fit and relaxed. The food was top class and breakfast had plenty of variety. The pool was a dream with its infinity edge fringing the valley with a great swim up bar with some nice cocktails all at reasonable prices. keep an eye out for happy hour. Two areas to eat one casual and relaxing as its surrounds the other a little more top class with views to impress both producing tasty quality food I would not hesitate to come back again. Thanks Padma Ubud for a memorable stay.,Positive
30,https://www.tripadvisor.com/Hotel_Review-g608492-d7907965-Reviews-or25-Padma_Resort_Ubud-Payangan_Gianyar_Regency_Bali.html,,,,,"Awesome views, awesome group, awesome tour guide.. this tour is definitely worth it!!!! We love jungle trekking on padma ubud!!! The trip is about 3 hours and we passed jungle, river.. the air was also very fresh",Positive
31,https://www.tripadvisor.com/Hotel_Review-g608492-d7907965-Reviews-or2140-Padma_Resort_Ubud-Payangan_Gianyar_Regency_Bali.html,Tomas J,Tomas J wrote a review Jan 2017,Very pleasant stay,Date of stay: December 2016,Beautiful and newly built hotel. Had a great stay there in December 2016. The pool is amazing and the staff was very friendly and helpful. Very relaxing atmosphere with the forest around the hotel and there were not many families during our stay. A bit far from central Ubud but the hotel is perfect if you plan on spending most of the time at the hotel/resort.,Positive
32,https://www.tripadvisor.com/Hotel_Review-g608492-d7907965-Reviews-or2105-Padma_Resort_Ubud-Payangan_Gianyar_Regency_Bali.html,LindieSA,LindieSA wrote a review Jan 2017,Amazing!!!!,Date of stay: January 2017,"Beautiful hotel, amazing pool, amazing food and best staff. Our family has traveled a lot, this is a true 5 star resort. We have a 4 year old son, kids club is a plus here. It's located in a middle of a forest, the view is very nice",Positive
33,https://www.tripadvisor.com/Hotel_Review-g608492-d7907965-Reviews-or30-Padma_Resort_Ubud-Payangan_Gianyar_Regency_Bali.html,Riny W,Riny W wrote a review Dec 2020,"""Will be visit here again""",Date of stay: December 2020,"Beautiful place and very heplfull staff. Very hygienic 🤗😘❤ hello if u like to running, this hotel have jogging track 😍❤❤❤ or you can rent for bicycle too N my kiddios have a new experience at garden n mini farm 🤗🙏🙏 Love it this hotel 😍❤❤❤🤗🤗",Positive
34,https://www.tripadvisor.com/Hotel_Review-g608492-d7907965-Reviews-or2225-Padma_Resort_Ubud-Payangan_Gianyar_Regency_Bali.html,Elaine A,Elaine A wrote a review Nov 2016,Fabulous place to unwind,Date of stay: October 2016,"Beautiful resort in the middle of the jungle !! Awesome infinity pool. We really recommend the spa, which will offer you a fantastic relaxing balinese spa experience. However service at the front desk can be HIGHLY improved.",Positive
35,https://www.tripadvisor.com/Hotel_Review-g608492-d7907965-Reviews-or2380-Padma_Resort_Ubud-Payangan_Gianyar_Regency_Bali.html,Natrdogg,Natrdogg wrote a review Jun 2016,Beautiful resort,Date of stay: May 2016,"Beautiful resort. However there are a couple things I wish I knew prior to booking the hotel. Let's start with the good things. The resort is beautiful. The grounds are amazing and the staff are even better!!! The hotel grounds are very clean and the staff are constantly cleaning it. The breakfast was some of the best meal we had. There was so many choices. It was amazing. Now on to the others. The hotel is very far from ubud central. It's about 45 minutes. There are only 4 shuttles running in a day!! (Should be constantly running) the shuttles only run in the times that the city is crowded, which means you can't beat the crowds and arrive to ubud central in the morning. To get a hotel shuttle at your own time was 250 k rupiah (not sure if it's per person or per car). Taxi",Positive
36,https://www.tripadvisor.com/Hotel_Review-g608492-d7907965-Reviews-or2360-Padma_Resort_Ubud-Payangan_Gianyar_Regency_Bali.html,,,,,"Beautiful, quiet and peaceful resort. Ideal for relaxation and escaping the hustle of the main tourist district. Fair way out of Ubud, but with a free shuttle bus, getting into town is easy. Wouldn't expect anything less from a Padma resort.",Positive
37,https://www.tripadvisor.com/Hotel_Review-g608492-d7907965-Reviews-Padma_Resort_Ubud-Payangan_Gianyar_Regency_Bali.html,Prasti Prabandari,Prasti Prabandari wrote a review Jan 27,The best experience in ubud,Date of stay: January 2021,"Been trying several 5 stars hotels in ubud but padma the best. Staffs are very warm and welcome, the pool is ah-ma-zing, activitynya banyak dan terutama yang paling bikin menyenangkan di temenin guide bli Dade selama main sepeda ke rumah penduduk sekitaran hotel dan diajarin golf, he is funny, helpful dan terutama pinter ngambil foto dan video (penting!)👍🏼 definitely will comeback to padma ubud🥰",Positive
